{
  "provider": "fixture",
  "symbol": "XE",
  "retrieved_at": "2026-08-07T00:00:00Z",
  "bars": [
    {"date":"2026-01-02","open":100,"high":101,"low":99,"close":100,"volume":1000},
    {"date":"2026-01-05","open":100.2,"high":101.7,"low":99.8,"close":101.1,"volume":1100},
    {"date":"2026-01-06","open":101.2,"high":102.3,"low":100.5,"close":101.8,"volume":1200},
    {"date":"2026-01-07","open":101.6,"high":102.1,"low":100.7,"close":101.2,"volume":1050},
    {"date":"2026-01-08","open":101.3,"high":103.0,"low":100.9,"close":102.6,"volume":1300},
    {"date":"2026-01-09","open":102.7,"high":104.0,"low":102.1,"close":103.5,"volume":1250},
    {"date":"2026-01-12","open":103.4,"high":103.8,"low":102.2,"close":102.9,"volume":900},
    {"date":"2026-01-13","open":102.8,"high":103.5,"low":101.7,"close":102.2,"volume":950},
    {"date":"2026-01-14","open":102.1,"high":104.2,"low":101.9,"close":103.9,"volume":1400},
    {"date":"2026-01-15","open":104.0,"high":105.2,"low":103.4,"close":104.8,"volume":1500},
    {"date":"2026-01-16","open":104.7,"high":105.4,"low":103.8,"close":104.1,"volume":1150},
    {"date":"2026-01-19","open":104.0,"high":104.4,"low":102.5,"close":103.0,"volume":1000},
    {"date":"2026-01-20","open":103.1,"high":103.7,"low":101.6,"close":102.0,"volume":980},
    {"date":"2026-01-21","open":102.2,"high":103.0,"low":101.2,"close":102.7,"volume":1020},
    {"date":"2026-01-22","open":102.8,"high":104.4,"low":102.3,"close":103.9,"volume":1200},
    {"date":"2026-01-23","open":104.0,"high":105.5,"low":103.7,"close":104.9,"volume":1300},
    {"date":"2026-01-26","open":105.0,"high":106.2,"low":104.5,"close":105.8,"volume":1350},
    {"date":"2026-01-27","open":105.7,"high":106.0,"low":104.0,"close":104.6,"volume":1100},
    {"date":"2026-01-28","open":104.5,"high":105.0,"low":102.8,"close":103.4,"volume":1250},
    {"date":"2026-01-29","open":103.5,"high":104.8,"low":102.9,"close":104.2,"volume":1180},
    {"date":"2026-01-30","open":104.3,"high":106.1,"low":103.9,"close":105.5,"volume":1400},
    {"date":"2026-02-02","open":105.6,"high":107.0,"low":105.1,"close":106.5,"volume":1450},
    {"date":"2026-02-03","open":106.4,"high":106.8,"low":104.8,"close":105.3,"volume":1170},
    {"date":"2026-02-04","open":105.2,"high":105.8,"low":103.2,"close":104.0,"volume":1300},
    {"date":"2026-02-05","open":104.1,"high":105.0,"low":103.5,"close":104.6,"volume":1080},
    {"date":"2026-02-06","open":104.7,"high":106.2,"low":104.1,"close":105.9,"volume":1280},
    {"date":"2026-02-09","open":106.0,"high":107.7,"low":105.4,"close":107.2,"volume":1500},
    {"date":"2026-02-10","open":107.3,"high":108.0,"low":106.1,"close":106.8,"volume":1140},
    {"date":"2026-02-11","open":106.7,"high":107.0,"low":104.7,"close":105.4,"volume":1360},
    {"date":"2026-02-12","open":105.5,"high":106.8,"low":105.0,"close":106.2,"volume":1190},
    {"date":"2026-02-13","open":106.3,"high":108.1,"low":105.8,"close":107.6,"volume":1420},
    {"date":"2026-02-16","open":107.7,"high":109.3,"low":107.0,"close":108.8,"volume":1550},
    {"date":"2026-02-17","open":108.7,"high":109.0,"low":107.1,"close":107.9,"volume":1210},
    {"date":"2026-02-18","open":107.8,"high":108.4,"low":105.8,"close":106.5,"volume":1450},
    {"date":"2026-02-19","open":106.6,"high":108.0,"low":106.1,"close":107.4,"volume":1220},
    {"date":"2026-02-20","open":107.5,"high":109.2,"low":107.0,"close":108.7,"volume":1460},
    {"date":"2026-02-23","open":108.8,"high":110.5,"low":108.3,"close":109.9,"volume":1580},
    {"date":"2026-02-24","open":110.0,"high":110.3,"low":108.2,"close":109.0,"volume":1260},
    {"date":"2026-02-25","open":108.9,"high":109.5,"low":107.1,"close":107.8,"volume":1500},
    {"date":"2026-02-26","open":107.9,"high":109.2,"low":107.4,"close":108.6,"volume":1300},
    {"date":"2026-02-27","open":108.7,"high":110.4,"low":108.1,"close":109.8,"volume":1620}
  ]
}
